{
  "schema_version": "1.0",
  "stage": "LITERATURE",
  "status": "PASS",
  "inputs": [
    {"path":"decisions/H1-problem.json","sha256":"17c2c7142ca1a05c63cce41e3b003856320fd69ec5ecb35eda02c7d8fe6ed835"},
    {"path":"input/B题/B题.pdf","sha256":"b0b2ce649282c2d7063af3c30ac9c0d931512dc86014d3147bc765d8f1c8cf87"},
    {"path":"input/B题/附件/附件1.xlsx","sha256":"b42f8bdabe7497951284cd044386c3cdf9d349b5e8ef4baaa0336e65ff84c67b"},
    {"path":"input/B题/附件/附件2.xlsx","sha256":"24b3113e80d5ec5458ba4f447df9ed185578481e8b0081bdf0673689505e49d0"},
    {"path":"input/B题/附件/附件3.xlsx","sha256":"79e9f66a00409f1d1130d9f4f3d76b4d5e5a1ccd3ac2d24dc0af8ecc583d0ec8"},
    {"path":"input/B题/附件/附件4.xlsx","sha256":"9cf1400404c4560958da06685beb8c2e1e4df5918a6e13863663a54440ba12e3"},
    {"path":"01-intake/赛题结构化说明.json","sha256":"6befeac2c39bbc784f1a5c78ef9627ce143a51e2bc2d0151c55a8c5a8571eda4"},
    {"path":"01-intake/handoff.json","sha256":"1e5ad8b23662e8aa8d675b8ccaa7d77f8dd03b9c64f6c262fd3bfb19255eeabc"},
    {"path":"literature/input/baker_finch_2014_free_carrier_absorption.pdf","sha256":"4faf03732d380c6835ffb1a76c278df46e953c7a8ebd9d7653e22976d5907c71"},
    {"path":"literature/input/ballester_2025_wedged_thin_films.pdf","sha256":"55398cc1a933f15fa5a7c152a01e021b48e73cd25162d1ff28fd7b2e6da3e3b5"},
    {"path":"literature/input/ou_2023_silicon_carbide_photonics.pdf","sha256":"80498024a411c81411a19096402e04632722c34e31f2b4bcc10d9b1c2ebabd02"},
    {"path":"literature/input/quinten_2019_fft_layer_thickness.pdf","sha256":"8d24b00f37911bff53a16efaa07ca1e8c404c512a2d0ac872e33f6f733a7b74e"}
  ],
  "outputs": [
    {"path":"02-literature/文献清单.json","sha256":"43c9d78b03b70b1d4582fc62d1cb6ebdb8c725e4158630c849d63a49fc167352"},
    {"path":"02-literature/文献阅读结果.md","sha256":"e9391e654e71a453955c04db878d6b05509f8f846fd9b1a4e482245dea52bb03"},
    {"path":"02-literature/corpus/corpus-manifest.json","sha256":"8a9d35871218019dbea18592a848184fcfe1f1c9117bb2241b30463c2ddfa5ba"},
    {"path":"02-literature/corpus/chunks.jsonl","sha256":"ed18e19e4d018f375c97cef6c8f274a296872937bc37cb1ae0812f0a3b5de143"},
    {"path":"02-literature/corpus/text/L01.txt","sha256":"6c154c4f6cc2071783318917dda8a41913306b9642670026f9f1aa80d309cb36"},
    {"path":"02-literature/corpus/text/L02.txt","sha256":"b6fcb879e5cddf163538138b796c4a9da1bbeaf5b29b021fceaacfb60dff03fb"},
    {"path":"02-literature/corpus/text/L03.txt","sha256":"e4ab670cd94ff80fdab02dff1a317ff635e51582cbc79106924ae2020154fa28"},
    {"path":"02-literature/corpus/text/L04.txt","sha256":"543e0ada4b0445a13a0f72a6fd84173f2a70a94387fc487823fae6ef0add85b0"}
  ],
  "frozen_decisions": [
    {"path":"decisions/H1-problem.json","sha256":"17c2c7142ca1a05c63cce41e3b003856320fd69ec5ecb35eda02c7d8fe6ed835"}
  ],
  "assumptions": [],
  "unknowns": [
    "题目SiC外延层及衬底的多型、掺杂、温度、偏振和测量波段匹配的线性n(λ,N)、κ(λ,N)尚缺直接全文证据。",
    "仪器分辨率、相干长度、表面粗糙度、楔度及独立厚度真值未知。",
    "多光束证据阈值、可接受厚度差异和参数边界须在后续决策前预先固定。"
  ],
  "claims": [
    "全部4篇输入PDF均已尝试并成功由文本层提取，共生成339个带页码文本块。",
    "L01支持硅自由载流子吸收具有波长、浓度适用域；其1000–1500 nm重掺杂硅参数不可直接迁移到本题SiC。",
    "L02支持以复折射率、分层传播、楔形和衬底吸收描述潜在缺陷，但其示例误差不能成为本题阈值。",
    "L03只能支持SiC多型和材料迁移风险；其中非线性折射率n2不得当作本题线性红外折射率n。",
    "L04支持把FFT、局部条纹和物理谱回归作为待比较方法族，并指出色散、非等距采样、角度及多光束的限制。"
  ],
  "evidence": [
    "02-literature/文献阅读结果.md的逐篇证据卡为每项实质主张提供source ID和PDF页码/章节/表图定位。",
    "02-literature/文献清单.json及corpus/corpus-manifest.json记录4篇原始PDF、文本缓存的哈希、页数和提取来源。",
    "02-literature/文献阅读结果.md明确区分全文证据、跨文献分析、迁移风险和未解决缺口。"
  ],
  "warnings": [
    "PASS仅表示文献阅读交接完整，不代表模型路线、参数或新假设已获批准。",
    "任何影响模型结构、参数或结论的新假设必须由主控整理选择包并征求队长意见。",
    "无独立厚度真值时，双角、跨窗口和拟合稳定性不能证明真实准确度。",
    "只有机制证据和厚度影响均支持时才可触发多光束修正。",
    "handoff.json因自引用哈希在数学上不可实现，文件自身SHA-256记录在同目录handoff.sha256；outputs哈希覆盖其余所有阶段生成物。"
  ],
  "required_next_actions": [
    "主控先验证本handoff schema、所有输入输出哈希及handoff.sha256，再决定是否转交DESIGN。",
    "DESIGN仅提出候选与验证计划，不得把本交接中的方法含义当作H2路线选择或已批准假设。",
    "若某候选依赖新的结构、参数或结论性假设，主控必须形成中立选择包并征求队长意见。"
  ],
  "completed_at": "2026-09-07T00:00:00+08:00"
}
